{
  "$schema": "https://json-schema.org/draft/2020-12/schema",
  "title": "Command Code config.json",
  "description": "User-level Command Code preferences (~/.commandcode/config.json). Command Code writes this file itself as you use the CLI; the keys below mirror the CLI configuration registry. Docs: https://commandcode.ai/docs/settings",
  "type": "object",
  "properties": {
    "$schema": {
      "type": "string",
      "description": "Path or URL of this JSON Schema."
    },
    "provider": {
      "type": "string",
      "enum": ["anthropic", "github-copilot", "codex", "command-code"],
      "description": "Selected auth provider."
    },
    "model": {
      "type": "string",
      "description": "Default model id for new sessions. A running session keeps its current model."
    },
    "theme": {
      "type": "string",
      "enum": ["dark", "light", "auto"],
      "default": "auto",
      "description": "Terminal color theme. Auto detects your terminal background."
    },
    "compactMode": {
      "type": "string",
      "enum": ["default", "fast"],
      "default": "default",
      "description": "Auto-compact aggressiveness when context fills up."
    },
    "reasoningEffort": {
      "type": "object",
      "description": "Per-model reasoning effort, keyed by model id.",
      "additionalProperties": {
        "type": "string",
        "enum": ["low", "medium", "high", "xhigh", "max"]
      }
    },
    "featureModels": {
      "type": "object",
      "description": "Model overrides for background features and the planning/implementation lanes. A model id, or \"default\" to follow the curated default.",
      "properties": {
        "planning": { "$ref": "#/$defs/featureModel" },
        "implementation": { "$ref": "#/$defs/featureModel" },
        "titleGeneration": { "$ref": "#/$defs/featureModel" },
        "compaction": { "$ref": "#/$defs/featureModel" },
        "toolDescription": { "$ref": "#/$defs/featureModel" },
        "tasteLearning": { "$ref": "#/$defs/featureModel" },
        "tasteOnboarding": { "$ref": "#/$defs/featureModel" },
        "branchSummarization": { "$ref": "#/$defs/featureModel" },
        "vision": { "$ref": "#/$defs/featureModel" }
      },
      "additionalProperties": false
    },
    "collapsePastedText": {
      "type": "boolean",
      "default": true,
      "description": "Collapse long pasted/dictated text (over 300 chars) into a [first words... +NL] token."
    },
    "tasteLearning": {
      "type": "boolean",
      "default": true,
      "description": "Global toggle for taste learning."
    },
    "showTasteLearningInFeed": {
      "type": "boolean",
      "default": true,
      "description": "Show Taste learning notices in the conversation feed."
    },
    "ideContextEnabled": {
      "type": "boolean",
      "default": true,
      "description": "IDE context integration."
    },
    "autoInstallExtension": {
      "type": "boolean",
      "default": true,
      "description": "Auto-install the IDE extension on startup."
    },
    "defaultExportFormat": {
      "type": "string",
      "enum": ["html", "jsonl", "md"],
      "default": "html",
      "description": "Format a bare /export (no format or path) writes."
    },
    "defaultShareGistFormat": {
      "type": "string",
      "enum": ["html", "jsonl", "md"],
      "default": "html",
      "description": "Format a bare /share gist (no format argument) posts."
    },
    "treeFilterMode": {
      "type": "string",
      "enum": ["default", "no-tools", "user-only", "labeled-only", "all"],
      "default": "default",
      "description": "Default filter when opening /tree."
    },
    "branchSummarySkipPrompt": {
      "type": "boolean",
      "default": false,
      "description": "Never ask about summarizing when switching branches in /tree."
    },
    "onDemandToolDescriptions": {
      "type": "boolean",
      "default": true,
      "description": "Explain shell commands on permission prompts only when you press ctrl+e."
    },
    "codemode": {
      "type": "string",
      "enum": ["mcp", "tools", "off"],
      "default": "mcp",
      "description": "Scope of the codemode tool (MCP only, read-only + MCP tools, or off)."
    },
    "imageVisionEnabled": {
      "type": "boolean",
      "description": "Let a text-only model read attached images by describing them with the vision model. true = enabled, false = disabled; omit the key for \"ask\" (prompt on first use), which is the default."
    },
    "peekRecapDiagram": {
      "type": "boolean",
      "default": false,
      "description": "Draw a short text diagram recapping a task that changed files or ran commands."
    },
    "peekRecapDelayMinutes": {
      "type": ["integer", "string"],
      "enum": [
        0,
        1,
        2,
        5,
        10,
        15,
        30,
        60,
        "0",
        "1",
        "2",
        "5",
        "10",
        "15",
        "30",
        "60"
      ],
      "default": "0",
      "description": "Recap a finished task only after this many minutes passed since your last message. The CLI writes either a number or a numeric string."
    },
    "language": {
      "type": "string",
      "description": "CLI language."
    },
    "installed": {
      "type": "boolean",
      "description": "First-install detection (machine-written)."
    },
    "firstMessageSent": {
      "type": "boolean",
      "description": "First-message detection (machine-written)."
    },
    "themeOnboarded": {
      "type": "boolean",
      "description": "Theme onboarding state (machine-written)."
    }
  },
  "$defs": {
    "featureModel": {
      "type": "string",
      "description": "A model id, or \"default\" to reset to the curated default."
    }
  },
  "additionalProperties": true
}
